{"full_ledger":{"aggregation":"equal_size_target_macro_equivalent_to_pooled_counts","calls":6144,"outcome_counts":{"internal_error":0,"rejection":5624,"verified_match":0,"verified_nonmatch":520},"outcome_rates":{"internal_error":{"denominator":6144,"numerator":0},"rejection":{"denominator":6144,"numerator":5624},"verified_match":{"denominator":6144,"numerator":0},"verified_nonmatch":{"denominator":6144,"numerator":520}},"raw_successes":0,"symmetry_unique_successes":0},"macro_by_budget":[{"calls_per_target":64,"heuristic_macro_de":{"denominator":384,"numerator":0},"random_macro_de_denominator":384,"random_macro_de_numerator_summary":{"mean":{"denominator":1000,"numerator":0},"median":{"denominator":2,"numerator":0},"percentile_025":0,"percentile_975":0,"percentile_method":"nearest_rank_ceiling_v1"}},{"calls_per_target":256,"heuristic_macro_de":{"denominator":1536,"numerator":0},"random_macro_de_denominator":1536,"random_macro_de_numerator_summary":{"mean":{"denominator":1000,"numerator":0},"median":{"denominator":2,"numerator":0},"percentile_025":0,"percentile_975":0,"percentile_method":"nearest_rank_ceiling_v1"}},{"calls_per_target":1024,"heuristic_macro_de":{"denominator":6144,"numerator":0},"random_macro_de_denominator":6144,"random_macro_de_numerator_summary":{"mean":{"denominator":1000,"numerator":0},"median":{"denominator":2,"numerator":0},"percentile_025":0,"percentile_975":0,"percentile_method":"nearest_rank_ceiling_v1"}}],"macro_secondary":{"calls_to_first_success":{"censoring_rule":"per_target_pool_size_plus_one_v1","heuristic_macro_mean":{"denominator":6,"numerator":6150},"heuristic_right_censored_targets":6,"heuristic_target_summary":{"mean":{"denominator":6,"numerator":6150},"median":{"denominator":2,"numerator":2050},"percentile_025":1025,"percentile_975":1025,"percentile_method":"nearest_rank_ceiling_v1"},"random_macro_denominator":6,"random_macro_numerator_summary":{"mean":{"denominator":1000,"numerator":6150000},"median":{"denominator":2,"numerator":12300},"percentile_025":6150,"percentile_975":6150,"percentile_method":"nearest_rank_ceiling_v1"},"random_right_censored_target_count_summary":{"mean":{"denominator":1000,"numerator":6000},"median":{"denominator":2,"numerator":12},"percentile_025":6,"percentile_975":6,"percentile_method":"nearest_rank_ceiling_v1"}},"naudc_through_1024":{"heuristic_macro":{"denominator":6291456,"numerator":0},"method":"right_endpoint_rectangles_calls_1_through_1024_v1","random_macro_denominator":6291456,"random_macro_numerator_summary":{"mean":{"denominator":1000,"numerator":0},"median":{"denominator":2,"numerator":0},"percentile_025":0,"percentile_975":0,"percentile_method":"nearest_rank_ceiling_v1"}}},"primary":{"fixed_1000_permutation_upper_tail_proportion":{"denominator":1000,"numerator":1000},"heuristic":{"denominator":1536,"numerator":0},"heuristic_minus_random_mean":{"denominator":1536000,"numerator":0},"metric":"target_macro_symmetry_unique_de_at_256","random_mean":{"denominator":1536000,"numerator":0},"target_bootstrap_95_interval":{"denominator":1536000,"lower_numerator":0,"method":"six_target_resampling_with_replacement_nearest_rank_v1","replicates":10000,"seed":620723749299507041,"upper_numerator":0}},"schema_version":"partizan.baseline_suite_report.v0.1","stage":"stage_a","suite_input_id":"baseline-suite-input-sha256:6b199cd4b1c9cd205791143f197270ee89b7543ad6894818649c14f4be0d6648","suite_report_id":"baseline-suite-report-sha256:d9dd52f4e595871747affecebdacb82f3be5be12f7f80d5ae0a537c2feeb381e","target_reports":[{"pool_id":"pool-sha256:a75370e363bb127495411f57531d9a5a1fc0bd7997888218a70c2f87623ec273","report_id":"baseline-report-sha256:16c173bb1649ad62c83585969c32d763f1aa7c83c741d6ab1c62016e53398a83","sha256":"3d1578e80db8f2d1b0c6e5b8e58461c41fb554395d77f9e18865122368bcc4ff","target_id":"target-sha256:052f4191fdcbb6fa45716b97cc85949f8c2287c75d532893084955ab7c666122"},{"pool_id":"pool-sha256:f951093789b541975c6f1cc3fcfbe71318dd3f62a83f7f992c0c10968b8e108f","report_id":"baseline-report-sha256:9a947c56ad1dbe54d9e75547b37b0886fc0d210a01a4a1fa99bb9357e24c10e8","sha256":"c3ef508a73585bd3bae8041e53fcf013555d613f99fcc489e7d8c9a7a8ce2803","target_id":"target-sha256:07de65c35e848be61c6f96872b1b20f3a101efa9b461750c502060842599e0c6"},{"pool_id":"pool-sha256:027ba75d52c981c3a5906e9d2ab693a0034b4de0cf8973e8b07a46d9e4c5e2d6","report_id":"baseline-report-sha256:726dd4307f1d7a28b90e6c96bea09f959b892c2baf3ae12384f0b21877a63387","sha256":"8ee35cede4c423ed0e5b9248bc39ea7f9ba46140a8773a9f5d7ce73b861f97fc","target_id":"target-sha256:41bb336e2bee89d4bdf6b5b7a9d9e1c3c8e1fd27da111dbaecac18ae9e553d6a"},{"pool_id":"pool-sha256:6a85c7a3fe82d5710f2d81e3e26f9fd14cab5ee7a5c07f9dfae07bdc50805fc6","report_id":"baseline-report-sha256:764b8dd8dd00c4a54811a470f59756edb804ea913447876c6ba05992e4eeb24c","sha256":"6730c9766ea5194c0927b7065fb09e04401d1301cd162d142f73ec8bf445852b","target_id":"target-sha256:73492503d817eb3406951fa9fbe127e8f362401b7d9d695163d7e0c4b1ecdc00"},{"pool_id":"pool-sha256:56a5b80f3efcb435d895bb2ea34bd120f4dbefc803bf9351c200dad7aeb41c32","report_id":"baseline-report-sha256:2f0e0fc43e30b4ce8a7ad2b07bd687f43fc54baf081f19755ce68b9ad33ad5f5","sha256":"3918edaa309e648a83e5b78caeaf2ff815e772c87e9946b17eae77511fccdf77","target_id":"target-sha256:8ceee173bf9c9f8e498a058ba15e2d6e4d37ec3ce0b2b7caf8607ac63744ab5b"},{"pool_id":"pool-sha256:f43f45ce2e18550671cdaeffc79442f90f7c4c48832ff019ded951f4729e5674","report_id":"baseline-report-sha256:44e7bf8f6855a8d204aa82c5af428224c3e9263d84790d5e0fcbfb6f22b656d1","sha256":"bd3e7caf6e8d692f394573c40b1643831c84c4da7a5f4954be9496e9d1a25405","target_id":"target-sha256:f1b5c956d7454a2a939ed8e3a780a7baca58b2b5cddd44313db6f79b2fc20256"}]}
